{"artifact":{"path":"datasets/raw/contact.jsonl","real_count":25,"row_count":25,"sha256":"cb5a8c191eea880e0527b6f05b02c15209ce1d8dbc106015494f024012e73d15","synthetic_count":0},"dataset_id":"contact","dataset_version":"v0.1.0","groups":{"split_counts":{"development":1,"holdout":0,"validation":0},"total_count":1},"guide":"datasets/labeling-guides/contact.md","labels":{"adjudication_complete":true,"adjudicator":"adjudicator-01","categorical_kappa":0.9358974359,"double_labeled_count":25,"implementer":"repository_owner","independent_reviewer":"independent-reviewer-01","review":{"path":"datasets/evidence/contact_review.json","sha256":"715aaeff720ef428f7d94c2ee5b6f98f296426cf731e3be17a8be8df6e6df6f5"},"structured_exact_agreement":0.96},"pii_scan":{"path":"datasets/evidence/contact_scan.json","sha256":"00b26e578c0e8fa4c2a47d6a9a173bfb7749907696dbf751bfe331c6f38f4759"},"schema":"datasets/schemas/contact.schema.json","source":{"consent_ref":"datasets/evidence/consent.md","consent_sha256":"715d244c5153b3f043b9d1daaec3419ded302ab6e58d1175a064c7ed47465539","retention_ref":"datasets/evidence/retention.md","retention_sha256":"62b60637b160ae589202d569bec02e13242f0e4dfa599716cdd0ef7a861ad3a2","source_manifest":"datasets/manifests/contact-source.json","source_manifest_sha256":"7c7c5b96af3bd355f9b03d950c72a018d13762f1b74790843f87f45b61820051"},"splits":{"development":25,"holdout":0,"validation":0},"version":1}
