{"artifact":{"path":"datasets/raw/remote.jsonl","real_count":40,"row_count":40,"sha256":"c4e2f590199a38e635ce056c88f4028f89866f3840cff8ca56360552928135cd","synthetic_count":0},"dataset_id":"remote","dataset_version":"v0.1.0","groups":{"split_counts":{"development":1,"holdout":0,"validation":0},"total_count":1},"guide":"datasets/labeling-guides/remote.md","labels":{"adjudication_complete":true,"adjudicator":"adjudicator-01","categorical_kappa":0.9591836735,"double_labeled_count":40,"implementer":"repository_owner","independent_reviewer":"independent-reviewer-01","review":{"path":"datasets/evidence/remote_review.json","sha256":"c4078b043c9ae16243aac40c9bffaea48bf927324a5d6bad93b484c05253a26b"},"structured_exact_agreement":0.975},"pii_scan":{"path":"datasets/evidence/remote_scan.json","sha256":"e3b6d3a4531ccd86bf7f9df0fee72dc39e46744d9e09fd2b80ff3adf57ac9f04"},"schema":"datasets/schemas/remote.schema.json","source":{"consent_ref":"datasets/evidence/consent.md","consent_sha256":"715d244c5153b3f043b9d1daaec3419ded302ab6e58d1175a064c7ed47465539","retention_ref":"datasets/evidence/retention.md","retention_sha256":"62b60637b160ae589202d569bec02e13242f0e4dfa599716cdd0ef7a861ad3a2","source_manifest":"datasets/manifests/remote-source.json","source_manifest_sha256":"3e9614f5d2e42a9cf9ee34930dcafd2eb5a58dd7d90c46d9ce274feef438b52b"},"splits":{"development":40,"holdout":0,"validation":0},"version":1}
