{"artifact":{"path":"datasets/raw/policy_injection.jsonl","real_count":25,"row_count":25,"sha256":"8341a4c664b39f522f5eca75e646d8175f4986a602e9f4223d3055e5a073ff88","synthetic_count":0},"dataset_id":"policy_injection","dataset_version":"v0.1.0","groups":{"split_counts":{"development":1,"holdout":0,"validation":0},"total_count":1},"guide":"datasets/labeling-guides/policy_injection.md","labels":{"adjudication_complete":true,"adjudicator":"adjudicator-01","categorical_kappa":0.9358974359,"double_labeled_count":25,"implementer":"repository_owner","independent_reviewer":"independent-reviewer-01","review":{"path":"datasets/evidence/policy_injection_review.json","sha256":"07dc74a6fd9bdfb94f06c1aa0fcc2b5ef8e3edf7e607317de9a93c5d1ea72211"},"structured_exact_agreement":0.96},"pii_scan":{"path":"datasets/evidence/policy_injection_scan.json","sha256":"2d4d0a9b4b56e3c06829d7a7ee06eddc4ef4c93810b6d753bedf2ea076d963d2"},"schema":"datasets/schemas/policy_injection.schema.json","source":{"consent_ref":"datasets/evidence/consent.md","consent_sha256":"715d244c5153b3f043b9d1daaec3419ded302ab6e58d1175a064c7ed47465539","retention_ref":"datasets/evidence/retention.md","retention_sha256":"62b60637b160ae589202d569bec02e13242f0e4dfa599716cdd0ef7a861ad3a2","source_manifest":"datasets/manifests/policy_injection-source.json","source_manifest_sha256":"8f36ac3dc8703856d2cc5134a3826abcec5a4802b1d22a81ffa50349b308cb9d"},"splits":{"development":25,"holdout":0,"validation":0},"version":1}
