{"artifact":{"path":"datasets/raw/discovery_parser.jsonl","real_count":35,"row_count":35,"sha256":"716c026357417f2ce810b3daf03bbe03869273826065ef02fb9b6724440e896a","synthetic_count":0},"dataset_id":"discovery_parser","dataset_version":"v0.1.0","groups":{"split_counts":{"development":1,"holdout":0,"validation":0},"total_count":1},"guide":"datasets/labeling-guides/discovery_parser.md","labels":{"adjudication_complete":true,"adjudicator":"adjudicator-01","categorical_kappa":0.9541284404,"double_labeled_count":35,"implementer":"repository_owner","independent_reviewer":"independent-reviewer-01","review":{"path":"datasets/evidence/discovery_parser_review.json","sha256":"e74595eaaf924cba6f67c1e6789c415bb8722ae7e840a81c4eae7ff2a7eedfe4"},"structured_exact_agreement":0.9714285714},"pii_scan":{"path":"datasets/evidence/discovery_parser_scan.json","sha256":"ff786340b0516e516cc9d01433fc865ba054ae64396a81856490e5baff849bb3"},"schema":"datasets/schemas/discovery_parser.schema.json","source":{"consent_ref":"datasets/evidence/consent.md","consent_sha256":"715d244c5153b3f043b9d1daaec3419ded302ab6e58d1175a064c7ed47465539","retention_ref":"datasets/evidence/retention.md","retention_sha256":"62b60637b160ae589202d569bec02e13242f0e4dfa599716cdd0ef7a861ad3a2","source_manifest":"datasets/manifests/discovery_parser-source.json","source_manifest_sha256":"756eae9fc50549d9342bb7889b9d8bd01e7979710c1d59121a21f6bfd56a1482"},"splits":{"development":35,"holdout":0,"validation":0},"version":1}
