{"artifact":{"path":"datasets/raw/reconciliation.jsonl","real_count":20,"row_count":20,"sha256":"49258cc883bd7993ba16a90e45b2ec2ea706b86bd298f98a86be9bd501011ef7","synthetic_count":0},"dataset_id":"reconciliation","dataset_version":"v0.1.0","groups":{"split_counts":{"development":1,"holdout":0,"validation":0},"total_count":1},"guide":"datasets/labeling-guides/reconciliation.md","labels":{"adjudication_complete":true,"adjudicator":"adjudicator-01","categorical_kappa":0.9173553719,"double_labeled_count":20,"implementer":"repository_owner","independent_reviewer":"independent-reviewer-01","review":{"path":"datasets/evidence/reconciliation_review.json","sha256":"c24f3ff5db91d9c142f74a50e8af285807085ade70ea6bb49d2a6386011a9150"},"structured_exact_agreement":0.95},"pii_scan":{"path":"datasets/evidence/reconciliation_scan.json","sha256":"88ba193dde6a85cb8e779ce355adfe0c76856d48439c02c24c88d8531839432f"},"schema":"datasets/schemas/reconciliation.schema.json","source":{"consent_ref":"datasets/evidence/consent.md","consent_sha256":"715d244c5153b3f043b9d1daaec3419ded302ab6e58d1175a064c7ed47465539","retention_ref":"datasets/evidence/retention.md","retention_sha256":"62b60637b160ae589202d569bec02e13242f0e4dfa599716cdd0ef7a861ad3a2","source_manifest":"datasets/manifests/reconciliation-source.json","source_manifest_sha256":"9e98b39860c244f68d3320838767ae17fe9269a10abff57099c7bb92dcc52e93"},"splits":{"development":20,"holdout":0,"validation":0},"version":1}
