{"artifact":{"path":"datasets/raw/dedup.jsonl","real_count":60,"row_count":60,"sha256":"ffd5f51aa08874e7e0188ad94435b50c30071c0dff67c8b9e9ec4c843290f41d","synthetic_count":0},"dataset_id":"dedup","dataset_version":"v0.1.0","groups":{"split_counts":{"development":1,"holdout":0,"validation":0},"total_count":1},"guide":"datasets/labeling-guides/dedup.md","labels":{"adjudication_complete":true,"adjudicator":"adjudicator-01","categorical_kappa":0.972899729,"double_labeled_count":60,"implementer":"repository_owner","independent_reviewer":"independent-reviewer-01","review":{"path":"datasets/evidence/dedup_review.json","sha256":"8b2c1e5daf033159600c5d4718269dbc7b7448cb47e587a6aea4f632b9830a21"},"structured_exact_agreement":0.9833333333},"pii_scan":{"path":"datasets/evidence/dedup_scan.json","sha256":"d59cbb0bd3f74ad6c54262b0df2385055136ab39ac5d74fbd3db4eaad702672e"},"schema":"datasets/schemas/dedup.schema.json","source":{"consent_ref":"datasets/evidence/consent.md","consent_sha256":"715d244c5153b3f043b9d1daaec3419ded302ab6e58d1175a064c7ed47465539","retention_ref":"datasets/evidence/retention.md","retention_sha256":"62b60637b160ae589202d569bec02e13242f0e4dfa599716cdd0ef7a861ad3a2","source_manifest":"datasets/manifests/dedup-source.json","source_manifest_sha256":"4e78b21a06f94ff7d90feaaf06853b351b0183473951a3e682bb0513125d2206"},"splits":{"development":60,"holdout":0,"validation":0},"version":1}
