{"artifact":{"path":"datasets/raw/calendar.jsonl","real_count":24,"row_count":24,"sha256":"42b89576507d4e73a49ec4221a28255ca2f4b712d559952768357a1136fbebff","synthetic_count":0},"dataset_id":"calendar","dataset_version":"v0.1.0","groups":{"split_counts":{"development":1,"holdout":0,"validation":0},"total_count":1},"guide":"datasets/labeling-guides/calendar.md","labels":{"adjudication_complete":true,"adjudicator":"adjudicator-01","categorical_kappa":0.9166666667,"double_labeled_count":24,"implementer":"repository_owner","independent_reviewer":"independent-reviewer-01","review":{"path":"datasets/evidence/calendar_review.json","sha256":"82b78884726c1cd877d9c05a027b27478766385cf7b515ffa08b613d1f0d642b"},"structured_exact_agreement":0.9583333333},"pii_scan":{"path":"datasets/evidence/calendar_scan.json","sha256":"ce61f95f06e863c211f8454f94421abcc590defbef15c58fe2dda1ecc58647eb"},"schema":"datasets/schemas/calendar.schema.json","source":{"consent_ref":"datasets/evidence/consent.md","consent_sha256":"715d244c5153b3f043b9d1daaec3419ded302ab6e58d1175a064c7ed47465539","retention_ref":"datasets/evidence/retention.md","retention_sha256":"62b60637b160ae589202d569bec02e13242f0e4dfa599716cdd0ef7a861ad3a2","source_manifest":"datasets/manifests/calendar-source.json","source_manifest_sha256":"ab406985333d2ab78b4eb3426bb884221e6e0046a0c4b8ff7b5dc90d466b0c63"},"splits":{"development":24,"holdout":0,"validation":0},"version":1}
