{"artifact":{"path":"datasets/raw/evidence_match.jsonl","real_count":25,"row_count":25,"sha256":"3b3f850dc5a19ffcfcb4882e681199e2052fe423abdd1f2d9983dd92ef539dfe","synthetic_count":0},"dataset_id":"evidence_match","dataset_version":"v0.1.0","groups":{"split_counts":{"development":1,"holdout":0,"validation":0},"total_count":1},"guide":"datasets/labeling-guides/evidence_match.md","labels":{"adjudication_complete":true,"adjudicator":"adjudicator-01","categorical_kappa":0.9358974359,"double_labeled_count":25,"implementer":"repository_owner","independent_reviewer":"independent-reviewer-01","review":{"path":"datasets/evidence/evidence_match_review.json","sha256":"c859da05f9bda2d8589046eec20299c652e8171545fadfc97dfe69bbe770bc8c"},"structured_exact_agreement":0.96},"pii_scan":{"path":"datasets/evidence/evidence_match_scan.json","sha256":"c49f72f64afbbb18056178021b5edf783a1ab4e54c6514a068f3e3762f8de481"},"schema":"datasets/schemas/evidence_match.schema.json","source":{"consent_ref":"datasets/evidence/consent.md","consent_sha256":"715d244c5153b3f043b9d1daaec3419ded302ab6e58d1175a064c7ed47465539","retention_ref":"datasets/evidence/retention.md","retention_sha256":"62b60637b160ae589202d569bec02e13242f0e4dfa599716cdd0ef7a861ad3a2","source_manifest":"datasets/manifests/evidence_match-source.json","source_manifest_sha256":"2af37524d138b6dc6066f439ee8e128f320c44ae8a8a6934dadbd751e9d77497"},"splits":{"development":25,"holdout":0,"validation":0},"version":1}
