{"artifact":{"path":"datasets/raw/email.jsonl","real_count":40,"row_count":40,"sha256":"32d4efade66ea251f9ab44e00f7a11a7e9f5512823fe0e67d61f70537a7ff695","synthetic_count":0},"dataset_id":"email","dataset_version":"v0.1.0","groups":{"split_counts":{"development":1,"holdout":0,"validation":0},"total_count":1},"guide":"datasets/labeling-guides/email.md","labels":{"adjudication_complete":true,"adjudicator":"adjudicator-01","categorical_kappa":0.9591836735,"double_labeled_count":40,"implementer":"repository_owner","independent_reviewer":"independent-reviewer-01","review":{"path":"datasets/evidence/email_review.json","sha256":"b72d7aea8440ffc3af071bf253b75603d50df97cf39796b5c64f61ac638578a2"},"structured_exact_agreement":0.975},"pii_scan":{"path":"datasets/evidence/email_scan.json","sha256":"1e3b572e5f72c581d9ac851b13803dda51ae1b18e150df1adfdb6f8abee9f58d"},"schema":"datasets/schemas/email.schema.json","source":{"consent_ref":"datasets/evidence/consent.md","consent_sha256":"715d244c5153b3f043b9d1daaec3419ded302ab6e58d1175a064c7ed47465539","retention_ref":"datasets/evidence/retention.md","retention_sha256":"62b60637b160ae589202d569bec02e13242f0e4dfa599716cdd0ef7a861ad3a2","source_manifest":"datasets/manifests/email-source.json","source_manifest_sha256":"01db2f6b8848880486e07061768e7a08974b7b7e3502b4fd3a65ca0b53dbc333"},"splits":{"development":40,"holdout":0,"validation":0},"version":1}
